{
  "name": "grid_puzzle_solver",
  "version": "0.1.0",
  "plugin_api_version": "2.0",
  "description": "Solveur Z3 pour grilles de logique. Variantes actuelles: Sudoku classique, Sudoku X, Anti Diagonal, Center Dot, Windoku, Girandola, Asterisk, Sujiken, Samurai Sudoku, Flower Sudoku, Sohei Sudoku, Kazaguruma, Greater Than / Compdoku, Rossini, Sudoku XV, Skyscraper, Frame, Godoku et Even-Odd.",
  "author": "MysterAI",
  "plugin_type": "python",
  "entry_point": "main.py",
  "dependencies": ["z3-solver"],
  "categories": ["Solver", "Mystery"],
  "kinds": ["solver", "analyze"],
  "brute_force": false,
  "enable_scoring": false,
  "accept_accents": false,
  "heavy_cpu": true,
  "needs_network": false,
  "needs_filesystem": false,
  "timeout_seconds": 150,
  "capabilities": {
    "analyze": true,
    "decode": true,
    "encode": false
  },
  "defaults": {
    "include_in_analysis": true,
    "include_in_decode": true
  },
  "input_types": {
    "puzzle_type": {
      "type": "select",
      "label": "Type de grille",
      "options": [
        {"value": "sudoku_classic", "label": "Sudoku classique"},
        {"value": "sudoku_x", "label": "Sudoku X"},
        {"value": "sudoku_anti_diagonal", "label": "Anti Diagonal Sudoku"},
        {"value": "sudoku_center_dot", "label": "Center Dot"},
        {"value": "sudoku_windoku", "label": "Windoku"},
        {"value": "sudoku_girandola", "label": "Girandola"},
        {"value": "sudoku_asterisk", "label": "Asterisk"},
        {"value": "sujiken", "label": "Sujiken"},
        {"value": "samurai_sudoku", "label": "Samurai Sudoku / Gattai-5"},
        {"value": "flower_sudoku", "label": "Flower Sudoku / Musketry"},
        {"value": "sohei_sudoku", "label": "Sohei Sudoku"},
        {"value": "kazaguruma_sudoku", "label": "Kazaguruma / Windmill Sudoku"},
        {"value": "sudoku_greater_than", "label": "Greater Than / Compdoku"},
        {"value": "sudoku_rossini", "label": "Rossini Sudoku"},
        {"value": "sudoku_xv", "label": "Sudoku XV"},
        {"value": "sudoku_skyscraper", "label": "Skyscraper Sudoku"},
        {"value": "sudoku_frame", "label": "Frame / Outside Sum Sudoku"},
        {"value": "sudoku_godoku", "label": "Godoku / Wordoku"},
        {"value": "sudoku_even_odd", "label": "Even-Odd / Pair-Impair"},
        {"value": "custom_spec", "label": "Spec JSON generique"}
      ],
      "default": "sudoku_classic",
      "description": "Sudoku classique utilise une grille 9x9. Sudoku X ajoute les deux diagonales principales sans doublons. Anti Diagonal limite chacune des deux grandes diagonales a trois chiffres differents. Center Dot ajoute la region des centres de blocs 3x3. Windoku ajoute quatre regions 3x3 supplementaires. Girandola et Asterisk ajoutent chacun une extra-region de 9 cases. Sujiken utilise une grille triangulaire de 45 cases. Samurai, Flower, Sohei et Kazaguruma assemblent plusieurs grilles 9x9 chevauchantes. Greater Than ajoute des comparaisons >/< entre cases adjacentes. Rossini ajoute des fleches de bord sur les trois premieres cases vues depuis chaque cote. Sudoku XV ajoute des marques X/V entre cases adjacentes. Skyscraper ajoute des indices exterieurs de visibilite. Frame ajoute des sommes exterieures des trois cases voisines du bord. Godoku remplace les chiffres par 9 lettres. Even-Odd contraint certaines cases a etre paires ou impaires. Spec JSON permet de decrire une grille CSP finie."
    },
    "grid": {
      "type": "textarea",
      "label": "Grille",
      "placeholder": "530070000\n600195000\n098000060\n800060003\n400803001\n700020006\n060000280\n000419005\n000080079",
      "required": false,
      "description": "Pour Sudoku: 81 cases avec 0, ., _ pour les cases vides. Les espaces, pipes et separateurs de lignes sont ignores."
    },
    "spec": {
      "type": "textarea",
      "label": "Spec JSON",
      "placeholder": "{\"rows\":9,\"cols\":9,\"symbols\":[\"1\",\"2\",\"3\",\"4\",\"5\",\"6\",\"7\",\"8\",\"9\"],\"givens\":{\"r1c1\":\"5\"},\"constraints\":[]}",
      "required": false,
      "description": "Spec optionnelle pour de futures variantes: dimensions, symboles, cellules actives, valeurs donnees, regions et contraintes."
    },
    "alphabet": {
      "type": "string",
      "label": "Alphabet Godoku",
      "required": false,
      "description": "Neuf lettres uniques pour Godoku/Wordoku. Si absent, le moteur tente de les inferer depuis la grille."
    },
    "parity": {
      "type": "textarea",
      "label": "Parite Even-Odd",
      "required": false,
      "description": "Matrice 9x9 optionnelle pour Even-Odd: E/P/pair pour une case paire, O/I/impair pour une case impaire, 0 ou . pour une case sans contrainte."
    },
    "max_solutions": {
      "type": "number",
      "label": "Solutions max",
      "default": 2,
      "min": 1,
      "max": 25,
      "step": 1,
      "description": "2 permet de verifier l'unicite du Sudoku sans enumerer trop de solutions."
    },
    "solver_timeout_ms": {
      "type": "number",
      "label": "Timeout Z3 (ms)",
      "default": 10000,
      "min": 1000,
      "max": 120000,
      "step": 1000,
      "description": "Limite interne du solveur Z3 pour eviter les grilles trop ouvertes."
    },
    "watched_cells": {
      "type": "textarea",
      "label": "Cellules surveillees",
      "default": "",
      "required": false,
      "description": "References de cellules a extraire apres resolution, separees par espaces, virgules ou retours ligne. Exemple: r1c1 r1c2 r9c9."
    },
    "text": {
      "type": "textarea",
      "label": "Texte source",
      "required": false,
      "hidden": true,
      "default_value_source": "geocache_description",
      "description": "Champ cache utilise pour pre-remplir depuis une geocache si aucune grille explicite n'est fournie."
    }
  },
  "output_types": {
    "text_output": {
      "type": "string",
      "label": "Solution"
    },
    "grid": {
      "type": "object",
      "label": "Grille resolue"
    },
    "metadata": {
      "type": "object",
      "label": "Details de resolution"
    }
  }
}
